Product ID (#),Name,$ Price:,Quantity,Category,Description,Production Date (DD/MM/YYYY),Expiration Date (DD/MM/YYYY),Rating:,Status
105,Спаржа,7722,397,Овощи,"Помогает поддерживать нормальный уровень лептина, гормона насыщения.",1991-11-04,2009-01-05,0.13:,Sold
106,Волжанка,3202,794,Напитки,Отличается хорошей совместимостью с другими продуктами питания.,2015-11-05,2020-01-21,3.07:,Available for Pickup
107,Малина,1918,271,Фрукты,Подходит для использования в рецептах традиционной кухни разных стран.,1995-08-04,1998-01-05,0.52:,Awaiting Review
108,Вологодская,4478,626,Напитки,Прошел все необходимые сертификации и соответствует международным стандартам.,2007-01-01,2029-02-01,0.39:,Returned
109,Пастила,3900,948,Бакалея,"Отличается высоким содержанием мирицетина, флавоноида, обладающего антиоксидантными и противовоспалительными свойствами.",2022-05-13,2030-06-10,3.69:,Out of Stock
110,Патиссон,3068,849,Овощи,Отличается низким содержанием насыщенных жиров и холестерина.,1991-05-06,2006-05-10,3.14:,Shipping
111,Подставки под горячие блюда,5758,288,Товары для дома,Помогает поддерживать нормальный уровень артериального давления.,1995-02-05,2016-03-10,1.5:,Available for Pickup
112,Пакеты для Дня Земли,6063,287,Товары для дома,"Отличается высоким содержанием астаксантина, мощного антиоксиданта, полезного для кожи и суставов.",1994-01-13,2010-08-06,4.57:,Pending
113,Белокуриха,9793,513,Напитки,Прошел сертификацию на соответствие требованиям органических стандартов.,2018-04-12,2025-03-01,1.96:,Available for Pickup
114,Читинская,405,164,Напитки,"Отличается высоким содержанием кемпферола, флавоноида, полезного для здоровья сердца и сосудов.",2000-02-04,2014-04-02,0.58:,On Backorder
115,Лук-порей,9825,421,Овощи,Рекомендуется для включения в рацион беременных женщин и кормящих матерей.,2002-05-06,2029-06-01,4.61:,Temporarily Unavailable
116,Perrier,7967,978,Напитки,"Помогает поддерживать нормальный уровень эритропоэтина, гормона, стимулирующего производство эритроцитов.",2013-06-07,2023-04-01,1.71:,Out of Stock
117,Брынза,6493,630,Молочные продукты,"Отличается высоким содержанием витамина K, необходимого для свертывания крови и здоровья костей.",1997-06-16,2026-01-21,3.49:,Awaiting Payment
118,Шелковица,7564,850,Фрукты,"Помогает поддерживать нормальный уровень дофамина, гормона, отвечающего за мотивацию и удовольствие.",2013-11-03,2028-01-06,3.15:,Awaiting Review
119,Пармезан,6924,983,Молочные продукты,Является важным компонентом сбалансированного рациона питания.,1992-10-04,2019-05-02,4.59:,Out of Stock
120,Мука ржаная,6508,574,Бакалея,"Отличается высоким содержанием апигенина, флавоноида, полезного для здоровья мозга и иммунной системы.",2017-01-08,2028-01-09,3.92:,Shipping
121,Масала чай,1546,811,Напитки,"Является источником витаминов группы B, необходимых для энергетического обмена.",1995-03-12,2021-08-01,0.53:,Pending
122,Варено-копченая колбаса,3435,30,Мясо,"Отличается высоким содержанием нарингина, флавоноида, полезного для снижения уровня холестерина и улучшения пищеварения.",1992-10-08,2024-02-20,0.52:,Delivered
123,Пакеты для микроволновки,351,123,Товары для дома,"Помогает поддерживать нормальный уровень генистеина, изофлавона, полезного для здоровья костей и профилактики рака.",1993-04-04,2012-08-02,4.31:,On Backorder
124,Пакеты для Рождества,7798,806,Товары для дома,"Отличается высоким содержанием рибофлавина, необходимого для здоровья кожи и зрения.",1991-06-05,2030-01-01,2.49:,On Backorder
125,Помидор,1789,926,Овощи,Помогает сохранять бодрость и активность в течение дня.,2014-07-01,2016-09-04,1.13:,Pending
126,Vittel,819,925,Напитки,"Отличается высоким содержанием пиридоксина, необходимого для синтеза нейромедиаторов.",2003-05-15,2004-04-17,0.86:,Pending
127,Куриные ножки,8070,256,Мясо,"Отличается высоким содержанием рутина, флавоноида, укрепляющего сосуды и улучшающего кровообращение.",2002-09-16,2013-01-04,4.76:,Shipping
128,Курт,5645,833,Молочные продукты,Рекомендуется для ежедневного потребления в умеренных количествах.,2003-06-06,2006-04-05,1.23:,Shipping
129,Мята перечная сушеная,8426,432,Бакалея,Помогает поддерживать здоровье нервной системы благодаря содержанию магния.,2001-02-13,2001-04-04,1.29:,Out of Stock
130,Компот из сухофруктов,6940,56,Напитки,"Помогает поддерживать нормальный уровень фитоэстрогенов, веществ, полезных для женского здоровья.",2001-01-14,2007-01-12,2.41:,Temporarily Unavailable
131,Яблоко,7368,709,Фрукты,"Помогает поддерживать нормальный уровень даидзеина, изофлавона, полезного для здоровья женщин во время менопаузы.",2012-01-14,2024-02-08,4.05:,Cancelled
132,Термосы,614,203,Товары для дома,"Имеет низкий гликемический индекс, что делает его безопасным для диабетиков.",2007-04-09,2010-03-17,4.38:,In Stock
133,"Орехи (грецкий орех, миндаль, фундук)",9779,663,Бакалея,Отличается высокой питательностью и способен быстро утолить голод.,2004-02-22,2010-06-10,0.06:,Refunded
134,Петрушка корневая,6357,973,Овощи,"Отличается длительным сроком годности, что позволяет делать запасы.",2012-04-03,2019-02-02,2.32:,Available for Pickup
135,Пакеты для ярмарки,1297,376,Товары для дома,"Отличается устойчивостью к температурным изменениям, что облегчает хранение.",2014-03-01,2022-03-12,0.67:,Temporarily Unavailable
136,Морковь,4072,815,Овощи,"Отличается длительным сроком годности, что позволяет делать запасы.",2008-04-08,2014-01-03,0.51:,Out of Stock
