Product ID (#),Name,$ Price:,Quantity,Category,Description,Production Date (DD/MM/YYYY),Expiration Date (DD/MM/YYYY),Rating:,Status
1,Капуста белокочанная,7385,337,Овощи,"Доступен в различных упаковках и форматах, что упрощает выбор подходящего варианта.",2000-01-05,2005-02-08,1.18:,On Backorder
2,Пастрома,6655,208,Мясо,"Помогает поддерживать нормальный уровень глюкагона, гормона, регулирующего уровень глюкозы в крови.",1994-03-18,2019-02-03,2.29:,New
3,Катык,8276,689,Молочные продукты,"Является источником витаминов группы B, необходимых для энергетического обмена.",1998-03-15,2027-03-22,2.56:,Pending
4,Миргородская,2602,455,Напитки,Прошел строгий контроль качества на всех этапах производства.,2016-05-16,2020-01-04,0.51:,Out of Stock
5,Шаурма,3621,896,Мясо,"Отличается низким содержанием жира, что делает его подходящим для тех, кто следит за фигурой.",2022-02-01,2026-01-19,0.01:,Returned
6,Черный перец горошком,4642,951,Бакалея,"Отличается высоким содержанием лютеолина, флавоноида, обладающего противовоспалительными свойствами.",2013-01-28,2018-01-06,2.09:,Sold
7,Малина,6152,259,Фрукты,Подходит для использования в диетических программах для похудения.,2019-03-01,2022-10-06,3.07:,New
8,Портулак,9152,565,Овощи,"Помогает поддерживать нормальный уровень 5-гидрокситриптофана (5-HTP), предшественника серотонина.",2021-01-11,2022-05-12,0.74:,Returned
9,Рамбутан,731,91,Фрукты,"Отличается высоким содержанием пробиотиков, улучшающих микрофлору кишечника.",1993-02-08,1999-01-01,4.38:,Shipping
10,Соль,2877,146,Бакалея,"Отличается высоким содержанием нарингина, флавоноида, полезного для снижения уровня холестерина и улучшения пищеварения.",1993-01-16,2015-05-24,3.41:,Out of Stock
11,Моцарелла,2800,344,Молочные продукты,Рекомендуется для включения в рацион беременных женщин и кормящих матерей.,2021-03-16,2022-01-13,0.11:,Awaiting Payment
12,Патиссон,5189,10,Овощи,"Отличается низким содержанием жира, что делает его подходящим для тех, кто следит за фигурой.",2021-05-01,2024-01-01,0.62:,Pending
13,Киви,2422,283,Фрукты,Помогает поддерживать нормальный уровень глюкозы в крови.,2008-06-13,2019-01-17,2.73:,Backorder
14,Утка,6978,407,Мясо,"Помогает поддерживать нормальный уровень нарингина, флавоноида, полезного для снижения уровня холестерина и улучшения пищеварения.",1996-04-04,2023-03-08,3.45:,Awaiting Payment
15,Каша из полбы,596,624,Бакалея,"Отличается высоким содержанием нарингина, флавоноида, полезного для снижения уровня холестерина и улучшения пищеварения.",1996-02-08,2002-03-19,3.65:,In Stock
16,Пастернак,2918,265,Овощи,"Отличается высоким содержанием витаминов группы D, необходимых для здоровья костей и иммунитета.",2002-03-02,2017-07-07,2.43:,New
17,Масло сливочное,5611,558,Молочные продукты,Поддерживает иммунитет и общее состояние здоровья.,1990-03-20,2014-01-15,4.64:,Temporarily Unavailable
18,Абрикос,6919,380,Фрукты,Отличается натуральным составом и отсутствием искусственных добавок.,2012-08-11,2024-06-02,4.0:,Backorder
19,Кефир,1713,345,Напитки,Способствует нормализации обмена веществ в организме.,2009-04-03,2023-02-02,0.38:,Refunded
20,Помидор,6983,482,Овощи,Прошел проверку на соответствие экологическим нормам и стандартам.,1999-04-07,2004-07-04,3.91:,Backorder
21,Смоленская,3659,49,Напитки,"Помогает поддерживать нормальный уровень адреналина, гормона стресса и возбуждения.",2018-04-06,2027-03-04,0.77:,On Backorder
22,Блендер,2895,680,Товары для дома,Помогает поддерживать здоровый цвет лица и упругость кожи.,1995-01-08,2018-03-12,0.85:,Out of Stock
23,Творог,4123,567,Молочные продукты,"Отличается высоким содержанием антиоксидантов, защищающих клетки от окислительного стресса.",2007-07-01,2013-04-08,2.91:,Out of Stock
24,Нафтуся,2100,637,Напитки,Помогает поддерживать нормальный уровень сахара в крови.,2000-02-03,2000-07-09,2.78:,Available for Pickup
25,Гусиные потроха,5344,332,Мясо,Подходит для людей с непереносимостью лактозы благодаря специальной обработке.,2020-03-19,2021-04-18,0.63:,Returned
26,Творог,6051,878,Молочные продукты,Отличается универсальностью применения в кулинарии и пищевой промышленности.,1990-05-02,2025-03-07,1.73:,Cancelled
27,Черника,249,303,Фрукты,Рекомендуется для ежедневного потребления в умеренных количествах.,2015-01-04,2017-04-11,4.16:,Pending
28,Ряженка,9287,472,Молочные продукты,Представляет собой ценный источник питательных веществ для растущего организма.,1993-01-10,2006-03-20,4.06:,Awaiting Review
29,Магаданская,1671,413,Напитки,"Отличается высоким содержанием марганца, необходимого для здоровья костей и соединительных тканей.",2011-01-01,2023-05-14,0.82:,Awaiting Payment
30,Козлятина,7007,783,Мясо,"Помогает поддерживать нормальный уровень мелатонина, гормона сна.",2005-01-04,2012-01-04,2.4:,Sold
31,Сок морковный,3045,5,Напитки,"Помогает поддерживать нормальный уровень адреналина, гормона стресса и возбуждения.",2019-08-01,2030-05-06,4.4:,Awaiting Payment
32,Камамбер,8546,417,Молочные продукты,"Отличается высоким содержанием пребиотиков, способствующих здоровью кишечника.",2008-02-08,2013-01-04,3.26:,Delivered
33,Мандарин,3916,592,Фрукты,Подходит для использования в рецептах традиционной кухни разных стран.,2001-06-07,2005-01-17,0.75:,Out of Stock
34,Косулятина,4473,102,Мясо,"Отличается высоким содержанием DMAE, вещества, улучшающего умственную деятельность и настроение.",1997-02-19,2015-01-05,0.64:,Awaiting Review
35,Сливки,5694,517,Молочные продукты,Помогает поддерживать нормальный уровень гормонов в организме.,1996-02-05,2022-04-10,1.06:,New
36,Курт,2342,774,Молочные продукты,"Отличается высоким содержанием мирицетина, флавоноида, обладающего антиоксидантными и противовоспалительными свойствами.",2021-08-02,2028-04-09,1.18:,Awaiting Review
37,Пакеты для уборки,9005,635,Товары для дома,Отличается гипоаллергенностью и безопасностью для большинства людей.,2013-03-04,2015-09-08,1.74:,Awaiting Payment
38,Кабанятина,2916,811,Мясо,"Отличается высоким содержанием пикногенола, мощного антиоксиданта, полезного для кожи и сосудов.",2016-02-13,2029-01-01,2.84:,Returned
39,Апельсин,8078,907,Фрукты,"Отличается широким ассортиментом вкусов и форматов, удовлетворяя потребности разных категорий потребителей.",2022-03-05,2025-05-01,1.41:,Available for Pickup
40,Пакеты для Дня учителя,1121,512,Товары для дома,"Отличается высоким содержанием тиамина, необходимого для нормального функционирования нервной системы.",2003-03-01,2010-02-03,4.35:,In Stock
41,Чебуреки,9009,121,Мясо,"Отличается высоким содержанием L-карнозина, аминокислоты, полезной для мышц и мозга.",1995-05-01,2027-03-14,1.76:,Delivered
42,Эндивий,3482,198,Овощи,Способствует нормализации обмена веществ в организме.,2003-04-20,2022-01-04,3.73:,Sold
43,Черный перец горошком,545,847,Бакалея,"Отличается низким содержанием лактозы, что делает его доступным для людей с ее непереносимостью.",1991-05-03,2026-01-01,2.14:,Cancelled
44,Плавленые сырки,1283,899,Бакалея,"Отличается высоким содержанием кверцетина, флавоноида, обладающего антиоксидантными и противовоспалительными свойствами.",2019-04-10,2025-04-01,0.5:,Awaiting Payment
45,Майонез,4917,894,Бакалея,"Отличается высоким содержанием кверцетина, флавоноида, обладающего антиоксидантными и противовоспалительными свойствами.",2001-03-06,2019-04-11,4.17:,Awaiting Review
46,Лимон,4845,366,Фрукты,"Имеет низкий гликемический индекс, что делает его безопасным для диабетиков.",2014-03-01,2029-02-23,4.89:,Temporarily Unavailable
47,Молоко,2716,68,Молочные продукты,"Помогает улучшить состояние волос, ногтей и кожи.",2005-04-01,2026-06-06,1.42:,Shipping
48,Доски разделочные,9268,538,Товары для дома,"Отличается высоким содержанием витамина K, необходимого для свертывания крови и здоровья костей.",2006-02-05,2030-09-04,0.03:,Delivered
49,Сок апельсиновый,6018,937,Напитки,"Помогает поддерживать нормальный уровень фитоэстрогенов, веществ, полезных для женского здоровья.",2005-06-01,2009-01-15,4.71:,Cancelled
50,Баклажан,2802,439,Овощи,"Легко усваивается организмом, обеспечивая быстрое насыщение и энергию.",1995-02-05,2003-01-19,4.58:,Out of Stock
51,Фета,7157,664,Молочные продукты,"Отличается высоким содержанием ненасыщенных жирных кислот, полезных для сердца.",2006-01-05,2009-03-21,1.08:,New
52,Каша из дробленной полентовой крупы,710,986,Бакалея,Помогает укреплять стенки сосудов и улучшать кровообращение.,1992-02-11,2006-02-01,3.71:,On Backorder
53,Огурец,7571,455,Овощи,"Подходит для использования в диетах, направленных на снижение веса.",2004-07-24,2030-09-06,3.68:,Sold
54,Перец болгарский,8525,570,Овощи,"Помогает поддерживать нормальный уровень даидзеина, изофлавона, полезного для здоровья женщин во время менопаузы.",2007-01-04,2009-07-25,2.2:,Awaiting Payment
55,Масло оливковое,8096,986,Бакалея,Помогает поддерживать нормальный уровень гомоцистеина в крови.,2002-04-05,2011-03-02,1.85:,Cancelled
56,Скалки,394,395,Товары для дома,"Отличается высоким содержанием пикногенола, мощного антиоксиданта, полезного для кожи и сосудов.",1995-02-05,1996-04-04,2.32:,Temporarily Unavailable
57,Отбивная,6371,927,Мясо,Подходит для использования в рецептах традиционной кухни разных стран.,1996-03-01,2021-11-04,3.31:,Backorder
58,Гусиные потроха,9112,251,Мясо,"Отличается высоким содержанием мирицетина, флавоноида, обладающего антиоксидантными и противовоспалительными свойствами.",2015-05-05,2023-08-13,3.33:,Out of Stock
59,Пакеты для офиса,4510,184,Товары для дома,"Может использоваться как основа для приготовления домашних йогуртов, сыров и других молочных продуктов.",1994-04-05,2026-06-12,1.01:,Refunded
60,Алтайская россыпь,8156,864,Напитки,"Помогает поддерживать нормальный уровень апигенина, флавоноида, полезного для здоровья мозга и иммунной системы.",2020-06-01,2026-01-08,1.5:,In Stock
61,Консервы мясные,6201,968,Мясо,"Отличается высоким содержанием инозитола, необходимого для здоровья нервной системы.",2014-06-11,2030-08-02,4.68:,Available for Pickup
62,Каша из булгура,3535,853,Бакалея,Улучшает настроение и общее самочувствие благодаря содержанию триптофана.,2009-01-03,2022-01-12,3.11:,Cancelled
63,Ополаскиватель для полости рта,314,902,Товары для дома,"Помогает поддерживать нормальный уровень дофамина, гормона, отвечающего за мотивацию и удовольствие.",1992-03-02,2011-01-03,0.33:,New
64,Fruko Schulz,9092,164,Напитки,"Отличается низким содержанием лактозы, что делает его доступным для людей с ее непереносимостью.",2010-05-07,2020-05-16,2.46:,Refunded
65,Краснодарская,9398,361,Напитки,Прошел тщательный отбор сырья и контроль на каждом этапе производства.,2001-03-11,2002-03-03,2.93:,Pending
66,Редис,6922,428,Овощи,"Помогает поддерживать нормальный уровень глюкагона, гормона, регулирующего уровень глюкозы в крови.",1997-05-11,2014-03-20,4.35:,Awaiting Payment
67,Варенец,4593,863,Молочные продукты,Помогает поддерживать нормальный уровень гормонов в организме.,2009-03-04,2023-02-05,1.24:,Available for Pickup
68,Имбирь молотый,2478,948,Бакалея,"Отличается приятным ароматом, который усиливает аппетит.",2004-03-15,2008-04-16,0.05:,Pending
69,Российский сыр,3160,948,Молочные продукты,Служит основой для создания множества кулинарных шедевров.,1998-06-02,2006-05-05,3.39:,Sold
70,Гамбургеры,4033,469,Мясо,Способствует поддержанию нормальной микрофлоры кишечника.,1991-05-12,2027-06-13,1.13:,Refunded
71,Пастернак,560,995,Овощи,"Помогает поддерживать нормальный уровень глутатиона, главного антиоксиданта организма.",1995-09-04,2030-04-03,0.53:,Returned
72,Туалетная бумага,892,811,Товары для дома,Отличается натуральным составом и отсутствием искусственных добавок.,2016-10-09,2021-05-08,1.73:,Temporarily Unavailable
73,Укроп,5140,442,Овощи,Способствует нормализации обмена веществ в организме.,1993-01-10,1993-02-01,0.68:,Shipping
74,Камамбер,3413,826,Молочные продукты,"Помогает поддерживать нормальный уровень цистеина, аминокислоты, участвующей в синтезе глутатиона.",2004-09-15,2020-01-13,0.78:,Awaiting Review
75,Помидор,875,861,Овощи,"Отличается высоким содержанием рутина, флавоноида, укрепляющего сосуды и улучшающего кровообращение.",2017-01-24,2022-01-10,4.58:,On Backorder
76,San Pellegrino,647,850,Напитки,Отличается натуральным составом и отсутствием искусственных добавок.,1993-08-01,2025-02-11,4.0:,Cancelled
77,Ливерная колбаса,1711,859,Мясо,"Обладает мягким вкусом, который нравится многим потребителям.",2014-06-01,2018-07-18,1.99:,On Backorder
78,Папайя,375,572,Фрукты,"Обладает антиоксидантными свойствами, защищающими клетки от повреждений.",2021-10-03,2027-01-19,0.05:,Pending
79,Monster Energy,9067,50,Напитки,Способствует снижению уровня стресса и улучшению настроения.,2004-07-10,2022-01-14,4.17:,Delivered
80,Коктебельская,880,326,Напитки,"Отличается высоким содержанием нарингина, флавоноида, полезного для снижения уровня холестерина и улучшения пищеварения.",2001-02-14,2004-05-01,4.35:,On Backorder
81,Мята перечная сушеная,7020,590,Бакалея,"Отличается высоким содержанием цинка, необходимого для здоровой иммунной системы.",2000-06-08,2023-08-07,3.48:,Available for Pickup
82,Йогурт питьевой,7172,557,Напитки,"Подходит для приготовления как горячих, так и холодных блюд.",1990-03-02,2029-04-04,4.73:,Awaiting Payment
83,Морковь,4449,771,Овощи,Подходит для использования в специализированных диетах и лечебных программах.,2016-01-19,2030-06-14,0.2:,Available for Pickup
84,Кокос,8619,761,Фрукты,"Отличается устойчивостью к температурным изменениям, что облегчает хранение.",2019-04-01,2020-01-07,1.26:,Backorder
85,Феодосийская,5977,980,Напитки,"Помогает улучшить состояние волос, ногтей и кожи.",1995-10-04,2005-03-01,0.68:,On Backorder
86,Абрикос,3100,653,Фрукты,"Отличается высоким содержанием меди, необходимой для синтеза коллагена и эластина.",1995-01-16,2004-02-05,0.15:,Out of Stock
87,Сливки,4338,830,Молочные продукты,"Помогает поддерживать нормальный уровень дигидротестостерона, гормона, отвечающего за половое созревание у мужчин.",1991-06-11,1994-02-04,2.42:,Backorder
88,Оленина,7505,37,Мясо,Отличается гипоаллергенностью и безопасностью для большинства людей.,2017-10-01,2027-03-15,4.76:,In Stock
89,Куриные голени,2849,785,Мясо,"Является источником важных нутриентов, необходимых для роста и развития детей.",2022-01-10,2024-07-06,5.0:,Temporarily Unavailable
90,Растительное масло кунжутное,2459,616,Бакалея,Может быть использован в качестве заменителя менее полезных продуктов.,2012-03-04,2016-01-02,1.69:,Delivered
91,Помело,620,805,Фрукты,"Производится из высококачественного сырья, что гарантирует его безопасность и пользу для здоровья.",2022-02-22,2023-01-20,4.73:,Available for Pickup
92,Пакеты для заморозки,544,313,Товары для дома,Улучшает настроение и общее самочувствие благодаря содержанию триптофана.,2009-06-01,2020-03-13,1.94:,In Stock
93,Верблюжье молоко,2391,499,Молочные продукты,Отличается стабильностью вкуса и качества в течение всего срока хранения.,2008-02-05,2024-02-06,0.17:,Temporarily Unavailable
94,Верблюжье молоко,9209,640,Молочные продукты,Прошел строгий контроль качества на всех этапах производства.,1990-07-03,2010-02-11,3.35:,Sold
95,Пакеты для хранения одежды,6281,657,Товары для дома,Придает блюдам особую нежность и насыщенность.,2006-01-03,2015-03-17,3.43:,Delivered
96,Пиво безалкогольное,3931,853,Напитки,"Отличается высоким содержанием пиридоксина, необходимого для синтеза нейромедиаторов.",2017-01-01,2026-07-08,4.3:,Temporarily Unavailable
97,Маринад для мяса,4065,367,Бакалея,"Помогает поддерживать нормальный уровень сапонинов, веществ, способствующих снижению уровня холестерина.",2000-02-01,2025-02-11,2.24:,Awaiting Review
98,"Семечки (тыквенные, подсолнечника)",9654,299,Бакалея,"Имеет низкий гликемический индекс, что делает его безопасным для диабетиков.",2000-07-03,2013-03-02,1.64:,Awaiting Review
99,Ветчина,9117,747,Мясо,"Подходит для использования в диетах, направленных на снижение веса.",2007-05-17,2009-07-01,0.64:,On Backorder
100,Повидло,6954,394,Бакалея,"Помогает поддерживать здоровую кожу, волосы и ногти благодаря содержанию биотина.",2012-03-05,2017-11-05,2.12:,Available for Pickup
101,Мыло твердое,8326,83,Товары для дома,Отвечает всем современным стандартам качества и безопасности.,2000-01-04,2003-03-07,1.58:,Cancelled
102,Кофеварка,2179,816,Товары для дома,"Отличается низким содержанием лактозы, что делает его доступным для людей с ее непереносимостью.",1998-01-09,2003-04-04,4.55:,Available for Pickup
103,Краснодарская,4472,869,Напитки,"Отличается высоким содержанием ресвератрола, вещества, обладающего антивозрастными свойствами.",2005-06-01,2019-04-08,0.18:,Backorder
104,Ряженка,8066,746,Молочные продукты,"Отличается высоким содержанием L-карнозина, аминокислоты, полезной для мышц и мозга.",1994-01-11,2002-05-07,2.54:,Refunded
